Owner,Repository Name,Repository Link,Stars,Forks,Issues,Pull Requests,Description,File Name,Dependency Name,Spec Name,Testing Framework,Created At
wikimedia,pywikibot,https://github.com/wikimedia/pywikibot,617,182,0,44,A Python library that interfaces with the MediaWiki API. This is a mirror from gerrit.wikimedia.org. Do not submit any patches here. See https://www.mediawiki.org/wiki/Developer_account for contributing.,ssh_execute_concurrent.py,pydocs,Console_CloseReader|Console_CloseWriter,pytest,6/19/2013
quantopian,trading_calendars,https://github.com/quantopian/trading_calendars,601,225,70,216,Calendars for various securities exchanges.,base_events.py,pydocs,Console_CloseErrorWriter|Console_CloseWriter,pytest,6/12/2018
hvac,hvac,https://github.com/hvac/hvac,1181,360,471,667,:lock: Python 3.X client for HashiCorp Vault,worker.py,requests,DataMustOpenInBinary,pytest,5/5/2015
fbchat-dev,fbchat,https://github.com/fbchat-dev/fbchat,1171,389,457,217,Facebook Chat (Messenger) for Python,rest.py,requests,DataMustOpenInBinary,pytest,4/18/2015
obspy,obspy,https://github.com/obspy/obspy,1122,518,1733,1697,ObsPy: A Python Toolbox for seismology/seismological observatories.,4factor.py,pydocs,Arrays_Comparable,pytest,9/8/2012
cloudera,hue,https://github.com/cloudera/hue,1093,340,1217,2409,Open source SQL Query Assistant service for Databases/Warehouses,util.py,pydocs,Arrays_Comparable,pytest,6/21/2010
mlcommons,inference,https://github.com/mlcommons/inference,1087,444,715,956,Reference implementations of MLPerf™ inference benchmarks,check_license.py,pydocs,ArgParse_Parent,pytest,9/13/2018
apache,impala,https://github.com/apache/impala,1083,483,0,67,Apache Impala,run_pelog_shell.py,pydocs,Console_CloseErrorWriter,pytest,4/13/2016
openapi-generators,openapi-python-client,https://github.com/openapi-generators/openapi-python-client,1080,180,335,589,Generate modern Python clients from OpenAPI,testing.py,pydocs,Arrays_Comparable,pytest,2/15/2020
sagemath,sage,https://github.com/sagemath/sage,1062,382,35467,2234,Main repository of SageMath. Now open for Issues and Pull Requests.,polynomial.py,pydocs,Arrays_Comparable,pytest,6/8/2012
roboflow,inference,https://github.com/roboflow/inference,1038,73,50,319,A fast  easy-to-use  production-ready inference server for computer vision supporting deployment of many popular model architectures and fine-tuned models.,openai_api.py,requests,DataMustOpenInBinary,pytest,7/31/2023
lmfit,lmfit-py,https://github.com/lmfit/lmfit-py,1013,263,366,512,Non-Linear Least Squares Minimization  with flexible Parameter settings  based on scipy.optimize  and with many additional classes and methods for curve fitting. ,capitalization.py,pydocs,Arrays_Comparable,pytest,8/1/2011
astroML,astroML,https://github.com/astroML/astroML,1007,293,156,121,Machine learning  statistics  and data mining for astronomy and astrophysics,icmpsh_m.py,pydocs,Console_CloseWriter,pytest,10/17/2012
robocorp,robocorp,https://github.com/robocorp/robocorp,335,43,158,235,Create 🐍 Python AI Actions and 🤖 Automations  and deploy & operate them anywhere,redirect.py,pydocs|requests,Console_CloseErrorWriter|Console_CloseWriter|DataMustOpenInBinary,pytest,3/20/2023
SourceCode-AI,aura,https://github.com/SourceCode-AI/aura,485,30,28,4,Python source code auditing and static analysis on a large scale,topN_perf.py,pydocs,Console_CloseErrorWriter|Console_CloseReader,pytest,9/23/2020
sergiocorreia,panflute,https://github.com/sergiocorreia/panflute,479,59,139,106,An Pythonic alternative to John MacFarlane's pandocfilters  with extra helper functions,ShellLint.py,pydocs,Console_CloseErrorWriter|Console_CloseWriter,pytest,3/30/2016
sentinelsat,sentinelsat,https://github.com/sentinelsat/sentinelsat,957,219,369,246,Search and download Copernicus Sentinel satellite images,handleCommand.py,pydocs,Console_CloseWriter,pytest,5/22/2015
sopel-irc,sopel,https://github.com/sopel-irc/sopel,950,397,1240,1360,:robot::speech_balloon: An easy-to-use and highly extensible IRC Bot framework. Formerly Willie.,partial_offer_requests.py,requests,DataMustOpenInBinary,pytest,12/22/2011
mosaicml,streaming,https://github.com/mosaicml/streaming,941,116,125,540,A Data Streaming Library for Efficient Neural Network Training,parser.py,pydocs,Arrays_Comparable,pytest,6/9/2022
circuits,circuits,https://github.com/circuits/circuits,301,57,147,190,circuits is a Lightweight Event driven and Asynchronous Application Framework for the Python Programming Language with a strong Component Architecture.,whitelist.py,pydocs,Console_CloseErrorWriter|Console_CloseReader|Console_CloseWriter,pytest,8/29/2013
e3nn,e3nn,https://github.com/e3nn/e3nn,878,125,150,209,A modular framework for neural networks with Euclidean symmetry,orngTabs.py,pydocs,Arrays_Comparable,pytest,1/31/2020
PaddlePaddle,Serving,https://github.com/PaddlePaddle/Serving,877,241,839,1153,A flexible  high-performance carrier for machine learning models（『飞桨』服务化部署框架）,foliolibrary.py,requests,DataMustOpenInBinary,pytest,3/31/2019
takluyver,pynsist,https://github.com/takluyver/pynsist,873,118,173,92,Build Windows installers for Python applications,post_parser.py,pydocs,Arrays_Comparable,pytest,3/30/2014
artisan-roaster-scope,artisan,https://github.com/artisan-roaster-scope/artisan,870,238,785,200,artisan: visual scope for coffee roasters,requests_lambda.py,requests,DataMustOpenInBinary,pytest,3/13/2015
DataDog,integrations-core,https://github.com/DataDog/integrations-core,866,1344,612,16834,Core integrations of the Datadog Agent,wereader.py,pydocs,Arrays_Comparable,pytest,12/1/2015
lhotse-speech,lhotse,https://github.com/lhotse-speech/lhotse,864,197,384,903,Tools for handling speech data in machine learning projects.,quickstart.py,pydocs,Console_CloseReader,pytest,4/24/2020
apache,incubator-livy,https://github.com/apache/incubator-livy,856,538,16,427,Apache Livy is an open source REST interface for interacting with Apache Spark from anywhere.,web.py,requests,DataMustOpenInBinary,pytest,6/25/2017
pywren,pywren,https://github.com/pywren/pywren,835,100,204,119,Teraflops and microservices,prestartup_script.py,pydocs,Console_CloseWriter,pytest,10/3/2016
postlund,pyatv,https://github.com/postlund/pyatv,824,86,967,1428,A client library for Apple TV and AirPlay devices,pdb.py,pydocs,Console_CloseReader,pytest,2/1/2017
aeon-toolkit,aeon,https://github.com/aeon-toolkit/aeon,809,81,491,986,A toolkit for machine learning from time series,sphinx_doc_gen.py,pydocs,Arrays_Comparable,pytest,12/20/2022
target,strelka,https://github.com/target/strelka,802,100,94,356,Real-time  container-based file scanning at enterprise scale,scan_falcon_sandbox.py,requests,DataMustOpenInBinary,pytest,9/20/2018
shedskin,shedskin,https://github.com/shedskin/shedskin,783,107,340,119,Shed Skin is a restricted-Python-to-C++ compiler. Read the introduction below to learn about the restrictions.,_cli.py,pydocs,Arrays_Comparable,pytest,7/2/2010
pytorch,benchmark,https://github.com/pytorch/benchmark,783,237,839,1415,TorchBench is a collection of open source benchmarks used to evaluate PyTorch performance.,ConvertMasmToNasm.py,pydocs,Console_CloseReader,pytest,5/26/2017
nipy,nipy,https://github.com/nipy/nipy,373,138,166,395,Neuroimaging in Python FMRI analysis package,upgrade.py,pydocs,Console_CloseErrorWriter|Console_CloseWriter,pytest,5/2/2010
f4pga,prjxray,https://github.com/f4pga/prjxray,737,139,477,1884,Documenting the Xilinx 7-series bit-stream format.,relabeling.py,pydocs,Arrays_Comparable,pytest,12/16/2017
AzureAD,microsoft-authentication-library-for-python,https://github.com/AzureAD/microsoft-authentication-library-for-python,735,183,284,358,"Microsoft Authentication Library (MSAL) for Python makes it easy to authenticate to Microsoft Entra ID. General docs are available here https://learn.microsoft.com/entra/msal/python/ Stable APIs are documented here https://msal-python.readthedocs.io. Questions can be asked on www.stackoverflow.com with tag ""msal"" + ""python"".",utils.py,requests,DataMustOpenInBinary,pytest,9/2/2016
Unidata,netcdf4-python,https://github.com/Unidata/netcdf4-python,726,251,883,437,netcdf4-python: python/numpy interface to the netCDF C library,Api.py,pydocs,Console_CloseWriter,pytest,1/13/2014
Mathics3,mathics-core,https://github.com/Mathics3/mathics-core,717,40,136,832,An open-source Mathematica. This repository contains the Python modules for WL Built-in functions  variables  core primitives  e.g. Symbol  a parser to create Expressions  and an evaluator to execute them.,ttor_logging.py,pydocs,Arrays_Comparable,pytest,9/11/2021
stan-dev,math,https://github.com/stan-dev/math,707,179,1290,1766,The Stan Math Library is a C++ template library for automatic differentiation of any order using forward  reverse  and mixed modes.  It includes a range of built-in functions for probabilistic modeling  linear algebra  and equation solving.,weakpass_generator.py,pydocs,Arrays_Comparable,pytest,7/1/2015
google-research,circuit_training,https://github.com/google-research/circuit_training,686,131,51,10,,__init__.py,pydocs,Arrays_Comparable,pytest,11/2/2021
lagadic,visp,https://github.com/lagadic/visp,672,280,410,963,Open Source Visual Servoing Platform,widgets.py,pydocs,Arrays_Comparable,pytest,9/15/2015
clinton-hall,nzbToMedia,https://github.com/clinton-hall/nzbToMedia,671,170,1579,412,Provides NZB and Torrent postprocessing To CouchPotatoServer  SickBeard/SickRage  HeadPhones  Mylar and Gamez,jsmonitor.py,pydocs,Console_CloseReader,pytest,11/10/2012
materialsproject,fireworks,https://github.com/materialsproject/fireworks,335,172,154,376,The Fireworks Workflow Management Repo.,remote_runner.py,pydocs,Console_CloseErrorWriter|Console_CloseWriter,pytest,1/8/2013
pychess,pychess,https://github.com/pychess/pychess,666,180,1625,582,PyChess - a chess client for Linux/Windows,_capi.py,pydocs,faulthandler_disableBeforeClose,pytest,2/2/2015
anki,cozmo-python-sdk,https://github.com/anki/cozmo-python-sdk,662,422,31,194,Anki Cozmo Python SDK,data_source.py,requests,DataMustOpenInBinary,pytest,10/14/2016
LineaLabs,lineapy,https://github.com/LineaLabs/lineapy,657,52,290,574,Move fast from data science prototype to pipeline. Capture  analyze  and transform messy notebooks into data pipelines with just two lines of code.,benchmark.py,pydocs,Console_CloseErrorWriter,pytest,7/28/2021
uber,peloton,https://github.com/uber/peloton,636,64,17,10,Unified Resource Scheduler to co-schedule mixed types of workloads such as batch  stateless and stateful jobs in a single cluster for better resource utilization.,fetch_events.py,pydocs,ArgParse_Parent,pytest,3/22/2017
swing-opensource,swingmusic,https://github.com/swing-opensource/swingmusic,608,36,118,78, Swing Music is a beautiful  self-hosted music player for your local audio files. Like a cooler Spotify ... but bring your own music.,supermemo_xml.py,pydocs,Console_CloseReader,pytest,11/14/2021
google,mobly,https://github.com/google/mobly,608,167,236,677,E2E test framework for tests with complex environment requirements.,create_mmp_db.py,pydocs,Console_CloseErrorWriter,pytest,11/7/2016
aws-ia,terraform-aws-control_tower_account_factory,https://github.com/aws-ia/terraform-aws-control_tower_account_factory,589,365,423,32,AWS Control Tower Account Factory,_http_requests.py,requests,DataMustOpenInBinary,pytest,11/3/2021
Josverl,micropython-stubs,https://github.com/Josverl/micropython-stubs,117,19,54,687,Stubs of most MicroPython ports  boards and versions to make writing code that much simpler.,kernelapp.py,pydocs,Console_CloseReader|Console_CloseErrorWriter|Console_CloseReader|Console_CloseErrorWriter|Console_CloseReader,pytest,10/17/2020
SqueezeAILab,KVQuant,https://github.com/SqueezeAILab/KVQuant,194,14,9,0,KVQuant: Towards 10 Million Context Length LLM Inference with KV Cache Quantization,safetensors_conversion.py,requests|pydocs,DataMustOpenInBinary|ArgParse_Parent|Arrays_Comparable,pytest,1/31/2024
pyparallel,pyparallel,https://github.com/pyparallel/pyparallel,580,25,8,0,Experimental multicore fork of Python 3,main.py,pydocs,faulthandler_tracetrackDumpBeforeClose,pytest,7/25/2015
biotite-dev,biotite,https://github.com/biotite-dev/biotite,559,84,137,404,A comprehensive library for computational molecular biology,download.py,requests,DataMustOpenInBinary,pytest,7/30/2017
ezyang,ghstack,https://github.com/ezyang/ghstack,556,49,85,156,Submit stacked diffs to GitHub on the command line,getpass.py,pydocs,Console_CloseReader,pytest,10/15/2018
snowflakedb,snowflake-connector-python,https://github.com/snowflakedb/snowflake-connector-python,555,437,661,1264,Snowflake Connector for Python,type.py,requests,DataMustOpenInBinary,pytest,6/29/2016
JHUISI,charm,https://github.com/JHUISI/charm,523,154,204,103,Charm: A Framework for Rapidly Prototyping Cryptosystems,platform.py,pydocs,Console_CloseErrorWriter,pytest,5/15/2011
rhinstaller,anaconda,https://github.com/rhinstaller/anaconda,520,336,0,5435,System installer for Fedora  RHEL and other distributions,main.py,pydocs,faulthandler_disableBeforeClose,pytest,2/2/2015
dit,dit,https://github.com/dit/dit,490,86,102,104,Python package for information theory.,cli.py,pydocs,Arrays_Comparable,pytest,9/29/2013
auth0,auth0-python,https://github.com/auth0/auth0-python,489,155,130,485,Auth0 SDK for Python,controller.py,requests,DataMustOpenInBinary,pytest,7/30/2014
pypa,wheel,https://github.com/pypa/wheel,475,140,386,227,The official binary distribution format for Python,generate_modules.py,pydocs,Arrays_Comparable,pytest,7/25/2017
salesforce,CodeRL,https://github.com/salesforce/CodeRL,475,59,27,32,This is the official code for the paper CodeRL: Mastering Code Generation through Pretrained Models and Deep Reinforcement Learning (NeurIPS22).,__init__.py,pydocs,faulthandler_disableBeforeClose,pytest,6/30/2022
NeoGeographyToolkit,StereoPipeline,https://github.com/NeoGeographyToolkit/StereoPipeline,472,134,361,53,The NASA Ames Stereo Pipeline is a suite of automated geodesy & stereogrammetry tools designed for processing planetary imagery captured from orbiting and landed robotic explorers on other planets.,nxOMSKeyMgmt.py,pydocs,Console_CloseErrorWriter,pytest,6/11/2010
jendrikseipp,rednotebook,https://github.com/jendrikseipp/rednotebook,470,107,568,145,RedNotebook is a cross-platform journal,logger.py,pydocs,Arrays_Comparable,pytest,6/30/2015
lablup,backend.ai,https://github.com/lablup/backend.ai,469,128,712,1391,Backend.AI is a streamlined  container-based computing cluster platform that hosts popular computing/ML frameworks and diverse programming languages  with pluggable heterogeneous accelerator support including CUDA GPU  ROCm GPU  TPU  IPU and other NPUs.,pdb_splitmodel.py,pydocs,Console_CloseReader,pytest,10/6/2016
hyprland-community,pyprland,https://github.com/hyprland-community/pyprland,232,15,79,13,Scratchpads & many goodies for Hyprland [maintainer=@fdev31],resource_sizes.py,pydocs,Console_CloseErrorWriter|Console_CloseReader,pytest,4/27/2023
hak5,nano-tetra-modules,https://github.com/hak5/nano-tetra-modules,461,134,31,66,The Official WiFi Pineapple Module Repository for the NANO & TETRA,report.py,requests,DataMustOpenInBinary,pytest,11/16/2017
youtube,cobalt,https://github.com/youtube/cobalt,218,100,0,3159,Cobalt is a lightweight HTML5 application container,elt.py,pydocs,Console_CloseErrorWriter|Console_CloseWriter,pytest,1/20/2016
subzeroid,instagrapi-rest,https://github.com/subzeroid/instagrapi-rest,431,117,29,28,RESTful API Wrapper for Instagram Private API,video.py,requests,DataMustOpenInBinary,pytest,3/15/2021
DetachHead,basedpyright,https://github.com/DetachHead/basedpyright,430,9,245,90,pyright fork with various type checking improvements  improved vscode support and pylance features built into the language server,generate_final_report.py,pydocs,ArgParse_Parent,pytest,12/2/2023
pypr,pysph,https://github.com/pypr/pysph,424,132,59,316,A framework for Smoothed Particle Hydrodynamics in Python,manager.py,pydocs,Arrays_Comparable,pytest,5/25/2017
SuperCowPowers,zat,https://github.com/SuperCowPowers/zat,415,108,73,78,Zeek Analysis Tools (ZAT):  Processing and analysis of Zeek network data with Pandas  scikit-learn  Kafka and Spark,__init__.py,pydocs,ArgParse_Parent,pytest,3/22/2017
theQRL,QRL,https://github.com/theQRL/QRL,411,102,219,1561,Quantum Resistant Ledger ,gtk-osx-jhbuildrc,pydocs,Console_CloseErrorWriter,pytest,10/16/2016
artefactual,archivematica,https://github.com/artefactual/archivematica,405,101,295,1572,Free and open-source digital preservation system designed to maintain standards-based  long-term access to collections of digital objects.,util.py,pydocs,Console_CloseWriter,pytest,9/14/2012
elastic,apm-agent-python,https://github.com/elastic/apm-agent-python,403,208,709,1322,Official Python agent for Elastic APM,api.py,pydocs,Console_CloseErrorWriter,pytest,7/13/2017
JanssenProject,jans,https://github.com/JanssenProject/jans,402,60,3450,4865,An open source enterprise digital identity platform for CIAM or workforce... Janssen is a distribution of standards-based  developer friendly  components that are engineered to work together in any cloud. #OAuth #OpenID #FIDO,terminalsize.py,pydocs,Console_CloseWriter,pytest,11/3/2020
WikidPad,WikidPad,https://github.com/WikidPad/WikidPad,195,41,67,22,WikidPad is a single user desktop wiki,gs-find,pydocs,Console_CloseReader|faulthandler_tracetrackDumpBeforeClose,pytest,2/18/2016
MoatLab,FEMU,https://github.com/MoatLab/FEMU,384,168,90,36,FEMU: Accurate  Scalable and Extensible NVMe SSD Emulator (FAST'18),test_faulthandler.py,pydocs,faulthandler_disableBeforeClose,pytest,12/19/2017
avrae,avrae,https://github.com/avrae/avrae,380,128,1304,688,A Discord bot to streamline running D&D 5e.,dbot.py,pydocs,faulthandler_disableBeforeClose,pytest,2/2/2017
osbuild,osbuild,https://github.com/osbuild/osbuild,189,107,229,1520,Build-Pipelines for Operating System Artifacts,ffmpeg.py,pydocs,Console_CloseErrorWriter|Console_CloseWriter,pytest,1/15/2019
dictation-toolbox,dragonfly,https://github.com/dictation-toolbox/dragonfly,373,66,144,245,Speech recognition framework allowing powerful Python-based scripting and extension of Dragon NaturallySpeaking (DNS)  Windows Speech Recognition (WSR)  Kaldi and CMU Pocket Sphinx,decode.py,pydocs,Console_CloseReader,pytest,5/26/2017
21dotco,two1-python,https://github.com/21dotco/two1-python,367,85,18,16,The 21 command line interface and two1 bitcoin library. Send and receive BTC over HTTP.,ping.py,requests,DataMustOpenInBinary,pytest,6/1/2016
rcmdnk,homebrew-file,https://github.com/rcmdnk/homebrew-file,347,29,107,161,Brewfile manager for  Homebrew,rename_objs_ot_tim_lex.py,pydocs,Arrays_Comparable,pytest,9/13/2013
CZ-NIC,knot-resolver,https://github.com/CZ-NIC/knot-resolver,338,56,64,44,Knot Resolver - resolve DNS names like it's 2024,ftplib.py,pydocs,Console_CloseErrorWriter,pytest,3/31/2015
deshaw,pyflyby,https://github.com/deshaw/pyflyby,337,46,139,199,A set of productivity tools for Python,eval_qm9_condition_quality.py,pydocs,faulthandler_disableBeforeClose,pytest,10/5/2018
trailofbits,fickling,https://github.com/trailofbits/fickling,331,41,27,80,A Python pickling decompiler and static analyzer,argopts.py,pydocs,Console_CloseReader,pytest,1/21/2021
flink-extended,ai-flow,https://github.com/flink-extended/ai-flow,165,35,93,292,AI Flow is an open source framework that bridges big data and artificial intelligence. ,convert_book.py,pydocs,Console_CloseErrorWriter|Console_CloseWriter,pytest,10/14/2021
tenable,pyTenable,https://github.com/tenable/pyTenable,327,160,412,354,Python Library for interfacing into Tenable's platform APIs,strategy_handler.py,requests,DataMustOpenInBinary,pytest,12/18/2017
Azure,azure-functions-python-worker,https://github.com/Azure/azure-functions-python-worker,326,94,792,625,Python worker for Azure Functions.,process.py,pydocs,Console_CloseErrorWriter,pytest,1/16/2018
common-workflow-language,cwltool,https://github.com/common-workflow-language/cwltool,321,213,785,1209,Common Workflow Language reference implementation,s3_util.py,pydocs,Console_CloseReader,pytest,10/7/2015
jswhit,pygrib,https://github.com/jswhit/pygrib,316,91,159,86, Python interface for reading and writing GRIB data ,sitepyxpcom.py,pydocs,Console_CloseWriter,pytest,12/29/2014
broadinstitute,gatk-sv,https://github.com/broadinstitute/gatk-sv,157,69,211,461,A structural variation pipeline for short-read sequencing,libssh_auth_bypass.py,pydocs,Console_CloseReader|Console_CloseWriter,pytest,6/18/2020
bolucat,Firefox,https://github.com/bolucat/Firefox,26,16,0,1,The Source Code of Firefox on Desktop,troubleshoot_full.py,requests|pydocs|requests,DataMustOpenInBinary|Console_CloseErrorWriter|Console_CloseReader|Arrays_Comparable|Console_CloseErrorWriter|Console_CloseReader|Console_CloseWriter|Arrays_Comparable|Console_CloseErrorWriter|Console_CloseReader|Console_CloseWriter|DataMustOpenInBinary,pytest,6/1/2021
aropan,clist,https://github.com/aropan/clist,308,23,290,54,Your comprehensive guide to global programming contests. Track events  get details  and never miss a competition.,knn.py,pydocs,Arrays_Comparable,pytest,5/16/2019
CJWorkbench,cjworkbench,https://github.com/CJWorkbench/cjworkbench,302,44,48,254,The data journalism platform with built in training,parse-shadow.py,pydocs,Console_CloseErrorWriter,pytest,10/17/2016
securesystemslab,zippy,https://github.com/securesystemslab/zippy,299,22,9,0,ZipPy is a Python3 interpreter on top of Truffle framework,utils.py,pydocs,Console_CloseErrorWriter,pytest,9/9/2016
allenai,allenact,https://github.com/allenai/allenact,295,46,91,288,An open source framework for research in Embodied-AI from AI2.,bgm.py,pydocs,Arrays_Comparable,pytest,1/14/2020
microsoftgraph,msgraph-sdk-python,https://github.com/microsoftgraph/msgraph-sdk-python,291,40,226,464,,hybris_requests_helper.py,requests,DataMustOpenInBinary,pytest,9/9/2022
smousavi05,EQTransformer,https://github.com/smousavi05/EQTransformer,281,139,123,31,EQTransformer  a python package for earthquake signal detection and phase picking using AI.,pychess,pydocs,faulthandler_disableBeforeClose,pytest,3/11/2020
MillionIntegrals,vel,https://github.com/MillionIntegrals/vel,274,32,46,29,Velocity in deep-learning research,main.py,pydocs,Arrays_Comparable,pytest,5/9/2018
bundlewrap,bundlewrap,https://github.com/bundlewrap/bundlewrap,270,23,436,314,Config management with Python,worker.py,pydocs,faulthandler_disableBeforeClose,pytest,6/13/2013
F5Networks,f5-common-python,https://github.com/F5Networks/f5-common-python,261,132,864,752,Python SDK for configuration and monitoring of F5® BIG-IP® devices via the iControl® REST API.,main.py,requests,DataMustOpenInBinary,pytest,10/27/2015
lenskit,lkpy,https://github.com/lenskit/lkpy,257,57,113,249,Python recommendation toolkit,train_pasta.py,pydocs,faulthandler_disableBeforeClose,pytest,6/8/2018
pymc-devs,pytensor,https://github.com/pymc-devs/pytensor,252,78,307,409,PyTensor allows you to define  optimize  and efficiently evaluate mathematical expressions involving multi-dimensional arrays.,rbssh.py,pydocs,Console_CloseReader,pytest,11/3/2022
mead-ml,mead-baseline,https://github.com/mead-ml/mead-baseline,243,71,68,865,Deep-Learning Model Exploration and Development for NLP,raspiwrite.py,pydocs,Console_CloseWriter,pytest,4/24/2016
Igalia,wpe-android,https://github.com/Igalia/wpe-android,60,12,86,74,WPE WebKit for Android,termui.py,pydocs,Console_CloseReader|Console_CloseErrorWriter|Console_CloseReader|Console_CloseWriter,pytest,5/11/2021
Parisson,Telemeta,https://github.com/Parisson/Telemeta,118,36,186,54,Collaborative content management system for musicology,roll_webgl_conformance.py,pydocs,Console_CloseErrorWriter|Console_CloseReader,pytest,10/25/2011
dongyh20,Octopus,https://github.com/dongyh20/Octopus,232,16,10,3,🐙Octopus  an embodied vision-language model trained with RLEF  emerging superior in embodied visual planning and programming.,weibo.py,requests,DataMustOpenInBinary,pytest,10/5/2023
rucio,rucio,https://github.com/rucio/rucio,228,295,2537,4189,Rucio - Scientific Data Management,up-and-coming-counter.py,pydocs,Arrays_Comparable,pytest,11/7/2017
Ackee-Blockchain,wake,https://github.com/Ackee-Blockchain/wake,205,22,124,187,Wake is a Python-based Solidity development and testing framework with built-in vulnerability detectors,gen_scene_feat.py,pydocs,Arrays_Comparable,pytest,1/12/2022
cctbx,cctbx_project,https://github.com/cctbx/cctbx_project,202,108,377,591,Computational Crystallography Toolbox,lambda_function.py,pydocs,Arrays_Comparable,pytest,7/22/2015
flathub-infra,website,https://github.com/flathub-infra/website,190,76,507,2614,Monorepo with website and API,core.py,requests,DataMustOpenInBinary,pytest,3/25/2022
goastian,midori-desktop,https://github.com/goastian/midori-desktop,62,9,19,39,Official repository code Midori Browser,shufflenet.py,pydocs,ArgParse_Parent|Console_CloseErrorWriter|Console_CloseWriter,pytest,10/8/2023
aws-samples,aws-ai-ml-workshop-kr,https://github.com/aws-samples/aws-ai-ml-workshop-kr,182,115,5,93,A collection of localized (Korean) AWS AI/ML workshop materials for hands-on labs.,CVE_2018_1273.py,requests,DataMustOpenInBinary,pytest,9/10/2018
westpa,westpa,https://github.com/westpa/westpa,182,46,67,335,WESTPA: The Weighted Ensemble Simulation Toolkit with Parallelization and Analysis,parser.py,pydocs,Console_CloseReader,pytest,9/29/2014
biolib,openprotein,https://github.com/biolib/openprotein,177,51,23,39,A PyTorch framework for prediction of tertiary protein structure,run_with_server_matrix.py,requests,DataMustOpenInBinary,pytest,9/8/2018
cocrawler,cocrawler,https://github.com/cocrawler/cocrawler,177,23,4,9,CoCrawler is a versatile web crawler built using modern tools and concurrency.,__init__.py,pydocs,faulthandler_disableBeforeClose,pytest,7/15/2016
