Owner,Repository Name,Repository Link,Stars,Forks,Issues,Pull Requests,Description,File Name,Dependency Name,Spec Name,Testing Framework,Created At
wangyx240,Multimodal-Input-Emotion-Recognition,https://github.com/wangyx240/Multimodal-Input-Emotion-Recognition,13,3,1,0,Multimodal emotion recognition system of attention based vision network + audio network  ,requirements.yml,tensorflow,N/A,pytest,12/9/2019
Merterm,Modeling-Intensification-for-SLG,https://github.com/Merterm/Modeling-Intensification-for-SLG,13,3,2,0,"Public repo for the paper: ""Modeling Intensification for Sign Language Generation: A Computational Approach"" by Mert Inan*<> Yang Zhong*, Sabit Hassan*, Lorna Quandt, Malihe Alikhani",requirements (1).txt,tensorflow,N/A,pytest,3/14/2022
bhaumik-choksi,RookieML,https://github.com/bhaumik-choksi/RookieML,13,2,1,0,A collection of notebooks explaining basic machine learning concepts,requirements.txt,tensorflow,N/A,pytest,10/21/2017
lumoe,dlkinematics,https://github.com/lumoe/dlkinematics,13,1,0,0,Differentiable Forward Kinematics for TensorFlow and Keras based on URDF files,requirements_dev.txt,tensorflow,N/A,pytest,2/18/2021
ig248,deepquantiles,https://github.com/ig248/deepquantiles,13,3,1,4,Deep Continuous Quantile Regression and other experiments.,Pipfile.lock,tensorflow,N/A,pytest,2/16/2019
stwind,SketchRNN_tf2,https://github.com/stwind/SketchRNN_tf2,13,6,2,0,SketchRNN Implementation in Tensorflow 2.0,Pipfile,tensorflow,N/A,pytest,11/2/2019
sebbyjp,robo_transformers,https://github.com/sebbyjp/robo_transformers,13,1,0,51,N/A,pyproject.toml,tensorflow,N/A,pytest,12/10/2023
ephes,data_science_tutorial,https://github.com/ephes/data_science_tutorial,13,2,4,8,Python data science and machine learning tutorial,pyproject.toml.old,tensorflow,N/A,pytest,5/10/2018
IDAES,examples,https://github.com/IDAES/examples,13,30,47,66,IDAES platform examples and tutorials,pyproject.toml,tensorflow,N/A,pytest,11/29/2022
ZhiyuanChen,DanLing,https://github.com/ZhiyuanChen/DanLing,13,2,0,22,N/A,pyproject.toml,tensorflow,N/A,pytest,1/28/2022
dfm,numpyro-ext,https://github.com/dfm/numpyro-ext,13,3,2,31,"A miscellaneous set of helper functions<> custom distributions, and other utilities that I find useful when using NumPyro in my work",pyproject.toml,tensorflow,N/A,pytest,7/26/2022
MaciejPMarciniak,SmoothAHAplot,https://github.com/MaciejPMarciniak/SmoothAHAplot,13,4,1,0,Class for producing smooth 17 and 18 segment left ventricle plot<> recommended by American Heart Association,pyproject.toml,tensorflow,N/A,pytest,5/8/2019
wandelbotsgmbh,geometricalgebra,https://github.com/wandelbotsgmbh/geometricalgebra,13,3,4,11,Library implementing conformal geometric algebra with autograd support,pyproject.toml,tensorflow,N/A,pytest,1/22/2024
Dataweekends,python_libraries_for_ml_and_dl,https://github.com/Dataweekends/python_libraries_for_ml_and_dl,13,10,0,0,Introduction to Pandas<> Scikit-Learn and Keras,environment.yml,tensorflow,N/A,pytest,7/31/2017
lntran26,donni,https://github.com/lntran26/donni,13,0,1,22,machine learning applications for dadi,environment.yml,tensorflow,N/A,pytest,9/12/2020
OnTrack-UG-Squad,speaker-verification,https://github.com/OnTrack-UG-Squad/speaker-verification,13,6,20,26,A public repository of work for the Speech Verification component of the undergrad squad for Doubtfire. ,environment.yml,tensorflow,N/A,pytest,12/13/2020
misterdev,flatland-marl,https://github.com/misterdev/flatland-marl,13,2,4,0,Flatland Multi Agent Reinforcement Learning,environment.yml,tensorflow,N/A,pytest,1/16/2020
jhcknzzm,SSL-Based-IRS-Channel-Estimation,https://github.com/jhcknzzm/SSL-Based-IRS-Channel-Estimation,13,1,1,0,N/A,environment.yml,tensorflow,N/A,pytest,10/18/2022
Shen-Lab,CPAC,https://github.com/Shen-Lab/CPAC,13,1,2,0,[Bioinformatics 2022] Cross-Modality and Self-Supervised Protein Embedding for Compound-Protein Affinity and Contact Prediction,environment.yml,tensorflow,N/A,pytest,1/13/2022
BobPXX,Lensless_Imaging_Transformer,https://github.com/BobPXX/Lensless_Imaging_Transformer,13,2,2,0,N/A,environment.yml,tensorflow,N/A,pytest,1/31/2022
jmaces,keras-adf,https://github.com/jmaces/keras-adf,13,2,2,2,Tensorflow/Keras implementation of Assumed Density Filtering (ADF) based probabilistic neural networks,tox.ini,tensorflow,N/A,pytest,11/20/2019
xhluca,keras-toolkit,https://github.com/xhluca/keras-toolkit,12,1,0,5,"A collection of functions to help you easily train and run Tensorflow Keras. It includes 1-line auto-TPU support<> GPU memory management, and tf.data builders.",setup.py,tensorflow,N/A,pytest,3/15/2021
Kapoorlabs-CAPED,vollseg-napari,https://github.com/Kapoorlabs-CAPED/vollseg-napari,12,1,6,3,Napari plugin for vollseg,setup.py,tensorflow,N/A,pytest,11/17/2021
LxzGordon,PECAN,https://github.com/LxzGordon/PECAN,12,3,3,0,N/A,setup.py,tensorflow,N/A,pytest,1/27/2023
EdVince,whisper-trtllm,https://github.com/EdVince/whisper-trtllm,12,2,0,0,Whisper in TensorRT-LLM,setup.py,tensorflow,N/A,pytest,8/21/2023
fiberleif,POfD,https://github.com/fiberleif/POfD,12,1,0,0,Reimplementation of Policy Optimization with Demonstrations (POfD) from ICML 2018.,setup.py,tensorflow,N/A,pytest,5/27/2019
ncbi-nlp,DeepRel,https://github.com/ncbi-nlp/DeepRel,12,4,3,13,A convolutional neural network model for relation extraction.,requirements.txt,tensorflow,N/A,pytest,2/28/2019
malingaperera,HMAB,https://github.com/malingaperera/HMAB,12,4,0,0,HMAB: Self-Driving Hierarchy of Bandits for Integrated Physical Database Design Tuning,requirements.txt,tensorflow,N/A,pytest,2/21/2022
baidu-research,catamount,https://github.com/baidu-research/catamount,12,5,4,39,"Catamount is a compute graph analysis tool to load<> construct, and modify deep learning models and to symbolically analyze their compute requirements",requirements.txt,tensorflow,N/A,pytest,11/20/2018
wellcometrust,grants_tagger,https://github.com/wellcometrust/grants_tagger,12,4,100,180,Tag grants with MeSH and other tags,unpinned_dev_requirements.txt,tensorflow,N/A,pytest,6/30/2020
debbiemarkslab,BEAR,https://github.com/debbiemarkslab/BEAR,12,3,3,4,"This repository is for the paper ""A generative nonparametric Bayesian model for whole genomes""",requirements.txt,tensorflow,N/A,pytest,4/17/2021
btaba,yarlp,https://github.com/btaba/yarlp,12,1,1,9,yet another reinforcement learning package,requirements.txt,tensorflow,N/A,pytest,2/27/2017
nikimanoledaki,finbot-api,https://github.com/nikimanoledaki/finbot-api,12,3,0,37,"🤖 API for Ubb<> a chatbot that trains a Natural Language Processing model using NLTK & TensorFlow to answer questions about personal finance, built with Django",Pipfile.lock,tensorflow,N/A,pytest,3/5/2020
chriskaschner,restful-api-flask,https://github.com/chriskaschner/restful-api-flask,12,4,0,3,Building a RESTful API with Flask for image recognition,Pipfile,tensorflow,N/A,pytest,8/23/2016
MokkeMeguru,TFGENZOO,https://github.com/MokkeMeguru/TFGENZOO,12,2,51,61,Library about construction helper for Generative models e.g. Flow-based Model with Tensorflow 2.x.,Pipfile,tensorflow,N/A,pytest,12/30/2019
nalzok,test-time-label-shift,https://github.com/nalzok/test-time-label-shift,12,1,0,0,Test-Time Label-Shift Adaptation,Pipfile.lock,tensorflow,N/A,pytest,8/16/2022
ilias-ant,tf-notify,https://github.com/ilias-ant/tf-notify,12,0,3,4,Want to get notified on the progress of your TensorFlow model training? Enter<> a TensorFlow Keras callback to send notifications on the messaging app of your choice.,pyproject.toml,tensorflow,N/A,pytest,7/14/2022
daanklijn,neurocoevolution,https://github.com/daanklijn/neurocoevolution,12,4,0,0,Code for our GECCO 2021 paper : A Coevolutionary Approach to Deep Multi-agent Reinforcement Learning,pyproject.toml,tensorflow,N/A,pytest,2/4/2021
alan-turing-institute,affinity-vae,https://github.com/alan-turing-institute/affinity-vae,12,6,184,126,Self-supervised method for disentanglement<> clustering and classification of objects in multidimensional image data,pyproject.toml,tensorflow,N/A,pytest,9/6/2022
hashtagml,optical,https://github.com/hashtagml/optical,12,0,0,30,A collection of utilities related to various computer vision tasks,pyproject.toml,tensorflow,N/A,pytest,3/28/2021
frgsimpson,kitt,https://github.com/frgsimpson/kitt,12,1,2,0,Kernel Identification Through Transformers,pyproject.toml,tensorflow,N/A,pytest,10/26/2021
jkyl,biggan,https://github.com/jkyl/biggan,12,2,11,7,BigGAN in idiomatic Keras,pyproject.toml,tensorflow,N/A,pytest,9/30/2017
chyalexcheng,grainLearning,https://github.com/chyalexcheng/grainLearning,12,5,0,0,A Bayesian uncertainty quantification toolbox for discrete and continuum models of granular materials. Note that this repository contains only the stable releases. For the most recent development of the GrainLearning project<> please go to https://github.com/GrainLearning/grainLearning.,pyproject.toml,tensorflow,N/A,pytest,7/2/2018
TrusteeML,emperor,https://github.com/TrusteeML/emperor,12,3,2,4,AI/ML and Cybersecurity: The Emperor has no Clothes,pyproject.toml,tensorflow,N/A,pytest,6/25/2021
Akhil-Sharma30,pystocktopus,https://github.com/Akhil-Sharma30/pystocktopus,12,0,0,6,"Library for Stock data management<> analysis, and prediction.",pyproject.toml,tensorflow,N/A,pytest,9/24/2023
exalearn,covid-drug-design,https://github.com/exalearn/covid-drug-design,12,4,10,0,Code and analyses related to the ExaLearn drug design efforts,environment.yml,tensorflow,N/A,pytest,4/21/2020
ciceklab,ECOLE,https://github.com/ciceklab/ECOLE,12,5,0,0,N/A,ECOLE_environment.yml,tensorflow,N/A,pytest,9/26/2022
imfht,flaskapps,https://github.com/imfht/flaskapps,12,4,1,2,a set of flask apps,environment.yml,tensorflow,N/A,pytest,1/31/2021
Edward-Sun,TSM-PDE,https://github.com/Edward-Sun/TSM-PDE,12,3,1,0,Code of ICML paper arxiv.org/abs/2302.08105,environment.yml,tensorflow,N/A,pytest,2/16/2023
ntelo007,road_detection_mtl,https://github.com/ntelo007/road_detection_mtl,12,10,1,46,Road Detection from Remote Sensing Imagery using Deep Learning Techniques,environment.yml,tensorflow,N/A,pytest,1/17/2020
yh1008,deepLearning,https://github.com/yh1008/deepLearning,12,1,0,0,"MNIST<> SVHN, Transfered Learning, DNN, CNN",environment.yml,tensorflow,N/A,pytest,4/29/2017
jonathan-taylor,ISLP,https://github.com/jonathan-taylor/ISLP,12,4,1,3,ISLP package: data and code for labs,environment.yml,tensorflow,N/A,pytest,10/11/2019
giulic3,flatland-challenge-marl,https://github.com/giulic3/flatland-challenge-marl,12,0,2,0,Proposed solution to the Flatland challenge (https://www.aicrowd.com/challenges/flatland-challenge)<> solving the Vehicle Rescheduling Problem (VRSP) on trains using Multi-Agent-Reinforcement-Learning,environment.yml,tensorflow,N/A,pytest,7/7/2019
deepsphere,deepsphere-tf1,https://github.com/deepsphere/deepsphere-tf1,12,1,1,2,DeepSphere: a graph-based spherical CNN (TensorFlow),environment.yml,tensorflow,N/A,pytest,11/7/2019
euclidity,transform-2020-ray,https://github.com/euclidity/transform-2020-ray,12,4,0,0,Code for the Transform 2020 Tutorial on Ray!,environment.yml,tensorflow,N/A,pytest,6/5/2020
marinaniet0,TransformerGrooveTap2Drum,https://github.com/marinaniet0/TransformerGrooveTap2Drum,12,0,0,7,N/A,environment.yml,tensorflow,N/A,pytest,5/16/2021
gschramm,pyapetnet,https://github.com/gschramm/pyapetnet,12,4,8,15,a CNN for anatomy-guided deconvolution and denoising of PET images,tox.ini,tensorflow,N/A,pytest,7/29/2019
changkun,ws-18-19-deep-learning-tutorial,https://github.com/changkun/ws-18-19-deep-learning-tutorial,12,1,0,0,Deep Learning and Artificial Intelligence Tutorial @ LMU WS 2018/19,req.txt,tensorflow,N/A,pytest,9/9/2018
wwwwwyyyyyxxxxx,SA2GVAN,https://github.com/wwwwwyyyyyxxxxx/SA2GVAN,11,1,1,0,N/A,setup.py,tensorflow,N/A,pytest,4/25/2023
qiyana-ratchet,news-vision,https://github.com/qiyana-ratchet/news-vision,11,3,0,17,Virtual news production using Tacotron2 and Wav2Lip,setup.py,tensorflow,N/A,pytest,4/4/2023
UPEIChemistry,tensor-field-networks,https://github.com/UPEIChemistry/tensor-field-networks,11,1,16,1,TFN layers built using Tensorflow 2,setup.py,tensorflow,N/A,pytest,6/14/2019
Ethos-lab,ares,https://github.com/Ethos-lab/ares,11,1,22,21,A System-Oriented Wargame Framework for Adversarial ML,setup.py,tensorflow,N/A,pytest,2/9/2022
felicitywang,TFMTL,https://github.com/felicitywang/TFMTL,11,1,1,1,A TensorFlow Framework for Multi-Task Learning and Text Classification,setup.py,tensorflow,N/A,pytest,4/16/2019
keshavbhandari,Electra-With-Compositional-Embeddings,https://github.com/keshavbhandari/Electra-With-Compositional-Embeddings,11,3,0,0,A custom Tensorflow implementation of Google's Electra NLP model with compositional embeddings using complementary partitions,setup.py,tensorflow,N/A,pytest,4/30/2021
YellenYeason,yolov8-prune,https://github.com/YellenYeason/yolov8-prune,11,0,3,0,yolov8-prune,setup.py,tensorflow,N/A,pytest,8/17/2023
Thomasbehan,SkinVestigatorAI,https://github.com/Thomasbehan/SkinVestigatorAI,11,2,3,29,SkinVestigatorAI is an open-source project for deep learning-based skin lesion detection. It aims to create a reliable tool and foster community involvement in critical AI problems. Contributions are welcome!,setup.py,tensorflow,N/A,pytest,4/2/2023
JakobThumm,safe_rl_manipulators,https://github.com/JakobThumm/safe_rl_manipulators,11,0,0,0,Verifiably Safe Deep Reinforcement Learning for Robotic Manipulationin Human Environments,setup.py,tensorflow,N/A,pytest,9/14/2021
mlcommons,inference_results_v1.1,https://github.com/mlcommons/inference_results_v1.1,11,23,8,8,This repository contains the results and code for the MLPerf™ Inference v1.1 benchmark. ,requirements.aarch64,tensorflow,N/A,pytest,9/20/2021
Ascend,ModelZoo-TensorFlow,https://github.com/Ascend/ModelZoo-TensorFlow,11,2,1,0,N/A,requirements.txt,tensorflow,N/A,pytest,4/20/2022
sriramkswamy,dotvim,https://github.com/sriramkswamy/dotvim,11,1,0,0,Vim dot files,requirements-global.txt,tensorflow,N/A,pytest,11/1/2015
NoNormalCreeper,Kori-Bot,https://github.com/NoNormalCreeper/Kori-Bot,11,3,1,17,A simple QQ Bot<> based on Nonebot2.,requirements.txt.bak,tensorflow,N/A,pytest,8/23/2021
shawnkx,SCDE,https://github.com/shawnkx/SCDE,11,0,0,31,Code and data for SCED sentence cloze dataset,requirements-dev.txt,tensorflow,N/A,pytest,4/26/2020
awebson,congressional_adversary,https://github.com/awebson/congressional_adversary,11,0,1,0,For our EMNLP 2020 paper “Are ‘Undocumented Workers’ the Same as ‘Illegal Aliens’? Disentangling Denotation and Connotation in Vector Spaces”.,requirements.txt,tensorflow,N/A,pytest,8/11/2019
danielenricocahall,Keras-SegNet,https://github.com/danielenricocahall/Keras-SegNet,11,2,2,0,Implementation of SegNet in Keras,requirements.txt,tensorflow,N/A,pytest,8/5/2019
raphaelLacerda,estrategia,https://github.com/raphaelLacerda/estrategia,11,6,0,0,N/A,Pipfile,tensorflow,N/A,pytest,6/26/2023
fubarlabs,foocars,https://github.com/fubarlabs/foocars,11,14,98,89,Low Cost Racing Autonomous Vehicles: RC Cars to Power Wheels Racers,pyproject.toml,tensorflow,N/A,pytest,3/23/2018
mangaki,zero,https://github.com/mangaki/zero,11,4,17,37,Mangaki's recommendation algorithms,pyproject.toml,tensorflow,N/A,pytest,9/8/2018
Jithsaavvy,Deploying-an-end-to-end-keyword-spotting-model-into-cloud-server-by-integrating-CI-CD-pipeline,https://github.com/Jithsaavvy/Deploying-an-end-to-end-keyword-spotting-model-into-cloud-server-by-integrating-CI-CD-pipeline,11,4,2,0,"The project is a concoction of research (audio signal processing<> keyword spotting, ASR), development (audio data processing, deep neural network training, evaluation) and deployment (building model artifacts, web app development, docker, cloud PaaS) by integrating CI/CD pipelines with automated tests and releases.",pyproject.toml,tensorflow,N/A,pytest,8/13/2022
Edgecortix-Inc,mera-tvm-public,https://github.com/Edgecortix-Inc/mera-tvm-public,11,3,0,1,EdgeCortix maintained and extended fork of Apache TVM compiler stack utilized by MERA framework. TVM is an open deep learning compiler stack for cpu<> gpu and specialized accelerators,pyproject.toml,tensorflow,N/A,pytest,3/10/2022
Charl-AI,Solstice,https://github.com/Charl-AI/Solstice,11,0,4,1,Library for scaling deep learning experiments in JAX,pyproject.toml,tensorflow,N/A,pytest,5/26/2022
Giskard-AI,giskard-vision,https://github.com/Giskard-AI/giskard-vision,11,0,0,34,👀 Assessing the quality of facial landmark computer vision models,pyproject.toml,tensorflow,N/A,pytest,11/27/2023
icecube,TFScripts,https://github.com/icecube/TFScripts,11,4,4,11,Some Functions for Tensorflow,pyproject.toml,tensorflow,N/A,pytest,3/30/2017
apax-hub,apax,https://github.com/apax-hub/apax,11,1,101,173,A flexible and performant framework for training machine learning potentials.,pyproject.toml,tensorflow,N/A,pytest,11/18/2022
836304831,langchain-anal,https://github.com/836304831/langchain-anal,11,2,0,0,N/A,pyproject.toml,tensorflow,N/A,pytest,7/15/2023
octo-technology,VIO,https://github.com/octo-technology/VIO,11,1,1,50,Visual Inspection Orchestrator is a modular framework made to ease the deployment of VI usecases,pyproject.toml,tensorflow,N/A,pytest,10/26/2022
Ramprasad-Group,multi-task-learning,https://github.com/Ramprasad-Group/multi-task-learning,11,1,4,0,N/A,pyproject.toml,tensorflow,N/A,pytest,2/12/2021
Clearbox-AI,clearbox-wrapper,https://github.com/Clearbox-AI/clearbox-wrapper,11,0,9,20,An agnostic wrapper for the most common ML frameworks.,pyproject.toml,tensorflow,N/A,pytest,5/22/2020
ESA-PhiLab,RobustMFSRforEO,https://github.com/ESA-PhiLab/RobustMFSRforEO,11,2,3,0,N/A,example-environment.yml,tensorflow,N/A,pytest,5/11/2022
PeerHerholz,workshop_weizmann,https://github.com/PeerHerholz/workshop_weizmann,11,4,5,0,"The repository for the ""MRI analysis in Python using Nipype<> Nilearn and more” at The Azrieli National Institute for Human Brain Imaging and Research.",environment.yml,tensorflow,N/A,pytest,9/27/2021
jfpuget,DSB_2018,https://github.com/jfpuget/DSB_2018,11,3,0,0,Code for the Data Science Bowl 2018 competition on Kaggle,environment.yml,tensorflow,N/A,pytest,4/18/2018
ilastik,tiktorch,https://github.com/ilastik/tiktorch,11,10,59,150,Tiktorch,environment.yml,tensorflow,N/A,pytest,7/18/2017
brain-map,neutorch,https://github.com/brain-map/neutorch,11,5,9,19,neuron segmentation and synapse detection using PyTorch,environment.yml,tensorflow,N/A,pytest,4/22/2021
HumanCompatibleAI,better-adversarial-defenses,https://github.com/HumanCompatibleAI/better-adversarial-defenses,11,3,1,0,Training in bursts for defending against adversarial policies,environment.yml,tensorflow,N/A,pytest,6/30/2020
samsucik,knowledge-distil-bert,https://github.com/samsucik/knowledge-distil-bert,11,0,1,12,Master's thesis project in collaboration with Rasa<> focusing on knowledge distillation from BERT into different very small networks and analysis of the students' NLP capabilities.,environment.yml,tensorflow,N/A,pytest,9/13/2019
aws-samples,explainability-methods-pitfalls,https://github.com/aws-samples/explainability-methods-pitfalls,11,3,1,7,N/A,environment.yml,tensorflow,N/A,pytest,7/10/2023
Teleoscope,Teleoscope,https://github.com/Teleoscope/Teleoscope,11,1,287,261,Teleoscope is a system for supporting qualitative research with machine learning workflows. ,environment.yml,tensorflow,N/A,pytest,8/16/2021
shreejitverma,Data-Scientist,https://github.com/shreejitverma/Data-Scientist,11,8,0,6,Everything Data Camp has on Data Science,environment.yml,tensorflow,N/A,pytest,3/9/2022
mukeshmithrakumar,scientific,https://github.com/mukeshmithrakumar/scientific,11,6,1,8,TensorFlow scientific is a library for scientific computing,tox.ini,tensorflow,N/A,pytest,6/14/2019
pgbrodrick,bfg-nets,https://github.com/pgbrodrick/bfg-nets,11,1,77,27,Framework for geospatial research CNN development.,tox.ini,tensorflow,N/A,pytest,3/4/2019
adhadse,Deepdubpy,https://github.com/adhadse/Deepdubpy,11,2,4,0,A complete end-to-end Deep Learning system to generate high quality human like speech in English for Korean Drama (WIP),tox.ini,tensorflow,N/A,pytest,1/1/2022
BlueBrain,atlas-alignment,https://github.com/BlueBrain/atlas-alignment,11,3,13,32,Blue Brain multi-modal registration and alignment toolbox,tox.ini,tensorflow,N/A,pytest,1/25/2021
Danyache,skoltech_image_cap,https://github.com/Danyache/skoltech_image_cap,11,5,0,0,Полное собрание кода для задач X-Ray captioning,req.txt,tensorflow,N/A,pytest,5/15/2020
ImperialNLP,MMT-Delib,https://github.com/ImperialNLP/MMT-Delib,10,3,0,1,N/A,setup.py,tensorflow,N/A,pytest,3/18/2019
AlexElvers,stplfcnn,https://github.com/AlexElvers/stplfcnn,10,2,1,0,Short-Term Probabilistic Load Forecasting at Low Aggregation Levels Using Convolutional Neural Networks,setup.py,tensorflow,N/A,pytest,9/15/2019
wandahangFY,YOLO-MIF,https://github.com/wandahangFY/YOLO-MIF,10,0,2,0,YOLO-MIF is an improved version of YOLOv8 for object detection in gray-scale images<> incorporating multi-information fusion to enhance detection accuracy.  YOLO-MIF是在灰度图像中进行目标检测的改进型YOLOv8模型，引入了多信息融合策略，提高了检测准确性。,setup.py,tensorflow,N/A,pytest,3/20/2024
larics,docker_files,https://github.com/larics/docker_files,10,7,1,18,Repository for docker files ,setup.py,tensorflow,N/A,pytest,11/20/2020
AI-Rank,AI-Rank,https://github.com/AI-Rank/AI-Rank,10,13,0,55,面向产业应用的AI开源评测基准,setup.py,tensorflow,N/A,pytest,12/1/2020
saalfeldlab,CNNectome,https://github.com/saalfeldlab/CNNectome,10,9,5,12,Scripts for building<> training and validating CNNs for Connectomics,setup.py,tensorflow,N/A,pytest,3/6/2018
alexgaskell10,nlp_summarization,https://github.com/alexgaskell10/nlp_summarization,10,7,1,1,Contains the code for my Imperial College London Master's thesis on text summarization,setup.py,tensorflow,N/A,pytest,9/1/2020
teamdatatonic,tf-sampling,https://github.com/teamdatatonic/tf-sampling,10,1,0,32,Effective sampling methods within TensorFlow input functions.,setup.py,tensorflow,N/A,pytest,10/22/2019
de-Boer-Lab,random-promoter-dream-challenge-2022,https://github.com/de-Boer-Lab/random-promoter-dream-challenge-2022,10,2,0,0,N/A,setup.py,tensorflow,N/A,pytest,1/30/2024
kubeflow,kfserving-lts,https://github.com/kubeflow/kfserving-lts,10,19,2,63,N/A,setup.py,tensorflow,N/A,pytest,2/15/2022
snuailab,waffle_utils,https://github.com/snuailab/waffle_utils,10,5,34,57,🧇Waffle Utils🧇 is a set of utilities for waffle components,setup.py,tensorflow,N/A,pytest,2/13/2023
Beomi,exbert-transformers,https://github.com/Beomi/exbert-transformers,10,3,1,0,exBERT on Transformers🤗,setup.py,tensorflow,N/A,pytest,6/10/2021
gmodena,tensor-fm,https://github.com/gmodena/tensor-fm,10,4,4,29,Polynomial regression and classification with sklearn and tensorflow,setup.py,tensorflow,N/A,pytest,10/24/2019
mhmgad,ExCut,https://github.com/mhmgad/ExCut,10,2,0,0,Implementation of ExCut: Explainable Embedding-based Clustering over Knowledge Graphs,pip_excut_requirements.txt,tensorflow,N/A,pytest,8/7/2020
daviddongkc,DocOIE,https://github.com/daviddongkc/DocOIE,10,3,3,0,Released Code for ACL 21 paper: DocOIE A Document-level Context-Aware Dataset for OpenIE,requirements.txt,tensorflow,N/A,pytest,5/10/2021
xmos,lib_agc,https://github.com/xmos/lib_agc,10,2,10,151,Automatic gain control library,requirements.txt,tensorflow,N/A,pytest,1/4/2017
brunoalano,aiotf,https://github.com/brunoalano/aiotf,10,0,0,7,Asyncio Tensorflow Serving Communication,Pipfile,tensorflow,N/A,pytest,6/21/2018
MarcosMJD,ml-mango-classification,https://github.com/MarcosMJD/ml-mango-classification,10,0,0,0,Machine Learning Model and Deployment for Classification of Mango Varieties ,Pipfile,tensorflow,N/A,pytest,11/26/2022
donkirkby,zero-play,https://github.com/donkirkby/zero-play,10,1,50,180,Teach a computer to play any game.,Pipfile.lock,tensorflow,N/A,pytest,11/27/2018
Taschee,schafkopf,https://github.com/Taschee/schafkopf,10,3,1,0,N/A,Pipfile,tensorflow,N/A,pytest,5/7/2018
leehanchung,smoking_detector,https://github.com/leehanchung/smoking_detector,10,5,1,50,Detecting Smoking in Videos,Pipfile,tensorflow,N/A,pytest,5/29/2019
Ramprasad-Group,copolymer_informatics,https://github.com/Ramprasad-Group/copolymer_informatics,10,2,3,0,Code for the paper Copolymer Informatics with Multi-Task Deep Neural Networks,pyproject.toml,tensorflow,N/A,pytest,3/25/2021
juliusfrost,minerl-rllib,https://github.com/juliusfrost/minerl-rllib,10,2,0,10,MineRL RLlib Benchmark,pyproject.toml,tensorflow,N/A,pytest,6/24/2020
d-lowl,bunny-party,https://github.com/d-lowl/bunny-party,10,0,0,0,A demonstration of how DVC and MLFlow can be used in the task of data relabeling,pyproject.toml,tensorflow,N/A,pytest,9/28/2023
ComPWA,tensorwaves,https://github.com/ComPWA/tensorwaves,10,4,97,420,Python fitter package for multiple computational back-ends,pyproject.toml,tensorflow,N/A,pytest,3/2/2020
plomgrading,plom,https://github.com/plomgrading/plom,10,3,0,15,Plom is Paperless Open Marking - mirror of https://gitlab.com/plom/plom,pyproject.toml,tensorflow,N/A,pytest,4/24/2020
sascha-kirch,DeepSaki,https://github.com/sascha-kirch/DeepSaki,10,0,14,27,"DeepSaki is an add-on to TensorFlow. It provides a variaty of custom classes ranging from activation functions to entire models<> helper functions to facilitate connectiong to your, compute HW and many more!",pyproject.toml,tensorflow,N/A,pytest,12/17/2021
gabrielelanaro,ml-prototypes,https://github.com/gabrielelanaro/ml-prototypes,10,6,30,23,A repository of machine learning prototypes,environment.yml,tensorflow,N/A,pytest,4/1/2019
mac-n,Clustering-GNN,https://github.com/mac-n/Clustering-GNN,10,1,0,0,Code for 'Alzheimer’s Disease Classification Using Cluster-based Labelling for Graph Neural Network on Tau PET Imaging and Heterogeneous Data ',GNNenvironment.yml,tensorflow,N/A,pytest,2/17/2022
