Owner,Repository Name,Repository Link,Stars,Forks,Issues,Pull Requests,Description,File Name,Dependency Name,Spec Name,Testing Framework,Created At
huggingface,transformers,https://github.com/huggingface/transformers,125717,23939,14721,15640,"🤗 Transformers: State-of-the-art Machine Learning for Pytorch<> TensorFlow, and JAX.",setup.py,tensorflow,N/A,pytest,10/29/2018
home-assistant,core,https://github.com/home-assistant/core,68882,27683,48560,67842,:house_with_garden: Open source home automation that puts local control and privacy first.,gen_requirements_all.py,tensorflow,N/A,pytest,9/17/2013
deepfakes,faceswap,https://github.com/deepfakes/faceswap,49355,12778,848,520,Deepfakes Software For All,sphinx_requirements.txt,tensorflow,N/A,pytest,12/19/2017
ultralytics,yolov5,https://github.com/ultralytics/yolov5,47200,14767,9056,2662,YOLOv5 🚀 in PyTorch > ONNX > CoreML > TFLite,pyproject.toml,tensorflow,N/A,pytest,5/18/2020
google-research,google-research,https://github.com/google-research/google-research,32929,7614,1185,806,Google Research,setup.py,tensorflow,N/A,pytest,10/4/2018
run-llama,llama_index,https://github.com/run-llama/llama_index,31471,4207,3848,4646,LlamaIndex is a data framework for your LLM applications,pyproject.toml,tensorflow,N/A,pytest,11/2/2022
ray-project,ray,https://github.com/ray-project/ray,31288,5190,17436,27491,Ray is a unified framework for scaling AI and Python applications. Ray consists of a core distributed runtime and a set of AI Libraries for accelerating ML workloads.,requirements_compiled.txt,tensorflow,N/A,pytest,10/25/2016
geekcomputers,Python,https://github.com/geekcomputers/Python,30016,11759,384,1773,My Python Examples,requirements_with_versions.txt,tensorflow,N/A,pytest,11/30/2011
google,jax,https://github.com/google/jax,28100,2530,5137,13417,"Composable transformations of Python+NumPy programs: differentiate<> vectorize, JIT to GPU/TPU, and more",pyproject.toml,tensorflow,N/A,pytest,10/25/2018
tqdm,tqdm,https://github.com/tqdm/tqdm,27519,1300,977,550,:zap: A Fast<> Extensible Progress Bar for Python and CLI,environment.yml,tensorflow,N/A,pytest,6/3/2015
deezer,spleeter,https://github.com/deezer/spleeter,24983,2723,766,120,Deezer source separation library including pretrained models.,pyproject.toml,tensorflow,N/A,pytest,9/26/2019
ultralytics,ultralytics,https://github.com/ultralytics/ultralytics,23338,4535,6861,2206,NEW - YOLOv8 🚀 in PyTorch > ONNX > OpenVINO > CoreML > TFLite,pyproject.toml,tensorflow,N/A,pytest,9/11/2022
shap,shap,https://github.com/shap/shap,21709,3101,2447,861,A game theoretic approach to explain the output of any machine learning model.,pyproject.toml,tensorflow,N/A,pytest,11/22/2016
jina-ai,jina,https://github.com/jina-ai/jina,20112,2170,1936,4172,☁️ Build multimodal AI applications with cloud-native stack,extra-requirements.txt,tensorflow,N/A,pytest,2/13/2020
microsoft,unilm,https://github.com/microsoft/unilm,18432,2338,1289,254,"Large-scale Self-supervised Pre-training Across Tasks<> Languages, and Modalities",setup.py,tensorflow,N/A,pytest,7/23/2019
duckdb,duckdb,https://github.com/duckdb/duckdb,17030,1419,4437,5625,DuckDB is an in-process SQL OLAP Database Management System,requirements-dev.txt,tensorflow,N/A,pytest,6/26/2018
ddbourgin,numpy-ml,https://github.com/ddbourgin/numpy-ml,14567,3611,50,43,Machine learning<> in numpy,requirements-dev.txt,tensorflow,N/A,pytest,4/6/2019
deeplearning4j,deeplearning4j,https://github.com/deeplearning4j/deeplearning4j,13445,3757,5749,4310,"Suite of tools for deploying and training deep learning models using the JVM. Highlights include model import for keras<> tensorflow, and onnx/pytorch, a modular and tiny c++ library for running math code and a java based math library on top of the core c++ library. Also includes samediff: a pytorch/tensorflow like library for running deep learning using automatic differentiation.",requirements.txt,tensorflow,N/A,pytest,11/27/2013
google-deepmind,deepmind-research,https://github.com/google-deepmind/deepmind-research,12828,2498,306,216,This repository contains implementations and illustrative code to accompany DeepMind publications,requirements.txt,tensorflow,N/A,pytest,1/15/2019
NVIDIA,DeepLearningExamples,https://github.com/NVIDIA/DeepLearningExamples,12660,2940,806,535,State-of-the-Art Deep Learning scripts organized by models - easy to train and deploy with reproducible accuracy and performance on enterprise-grade infrastructure.,requirements.txt,tensorflow,N/A,pytest,5/2/2018
marcotcr,lime,https://github.com/marcotcr/lime,11315,1751,627,116,Lime: Explaining the predictions of any machine learning classifier,environment.yml,tensorflow,N/A,pytest,3/15/2016
xmu-xiaoma666,External-Attention-pytorch,https://github.com/xmu-xiaoma666/External-Attention-pytorch,10916,1857,78,36,"🍀 Pytorch implementation of various Attention Mechanisms<> MLP, Re-parameter, Convolution, which is helpful to further understand papers.⭐⭐⭐",requires.txt,tensorflow,N/A,pytest,5/8/2021
ultralytics,yolov3,https://github.com/ultralytics/yolov3,10017,3247,1819,353,YOLOv3 in PyTorch > ONNX > CoreML > TFLite,pyproject.toml,tensorflow,N/A,pytest,8/26/2018
tflearn,tflearn,https://github.com/tflearn/tflearn,9606,2325,918,261,Deep learning library featuring a higher-level API for TensorFlow.,setup.py,tensorflow,N/A,pytest,3/31/2016
microsoft,computervision-recipes,https://github.com/microsoft/computervision-recipes,9304,1134,259,431,"Best Practices<> code samples, and documentation for Computer Vision.",environment.yml,tensorflow,N/A,pytest,2/11/2019
microsoft,LoRA,https://github.com/microsoft/LoRA,9167,573,101,69,"Code for loralib<> an implementation of ""LoRA: Low-Rank Adaptation of Large Language Models""",setup.py,tensorflow,N/A,pytest,6/18/2021
cleanlab,cleanlab,https://github.com/cleanlab/cleanlab,8718,659,342,736,The standard data-centric AI package for data quality and machine learning with messy<> real-world data and labels.,requirements-dev.txt,tensorflow,N/A,pytest,5/11/2018
wandb,wandb,https://github.com/wandb/wandb,8278,599,3112,4496,🔥 A tool for visualizing and tracking your machine learning experiments. This repo contains the CLI and Python API.,tox.ini,tensorflow,N/A,pytest,3/24/2017
yzhao062,pyod,https://github.com/yzhao062/pyod,7982,1302,327,217,A Comprehensive and Scalable Python Library for Outlier Detection (Anomaly Detection),requirements.txt,tensorflow,N/A,pytest,10/3/2017
google,trax,https://github.com/google/trax,7963,803,232,1563,Trax — Deep Learning with Clear Code and Speed,setup.py,tensorflow,N/A,pytest,10/5/2019
arogozhnikov,einops,https://github.com/arogozhnikov/einops,7956,329,168,110,"Flexible and powerful tensor operations for readable and reliable code (for pytorch<> jax, TF and others)",pyproject.toml,tensorflow,N/A,pytest,9/22/2018
aimacode,aima-python,https://github.com/aimacode/aima-python,7721,3510,397,899,"Python implementation of algorithms from Russell And Norvig's ""Artificial Intelligence - A Modern Approach""",requirements.txt,tensorflow,N/A,pytest,2/2/2016
apache,beam,https://github.com/apache/beam,7551,3983,6670,24530,Apache Beam is a unified programming model for Batch and Streaming data processing.,run_generate_requirements.sh,tensorflow,N/A,pytest,2/2/2016
sktime,sktime,https://github.com/sktime/sktime,7439,1261,2266,3725,A unified framework for machine learning with time series,pyproject.toml,tensorflow,N/A,pytest,11/6/2018
lmcinnes,umap,https://github.com/lmcinnes/umap,6970,740,768,276,Uniform Manifold Approximation and Projection,setup.py,tensorflow,N/A,pytest,7/2/2017
py-why,dowhy,https://github.com/py-why/dowhy,6776,904,441,691,DoWhy is a Python library for causal inference that supports explicit modeling and testing of causal assumptions. DoWhy is based on a unified language for causal inference<> combining causal graphical models and potential outcomes frameworks. ,pyproject.toml,tensorflow,N/A,pytest,5/31/2018
abhishekkrthakur,approachingalmost,https://github.com/abhishekkrthakur/approachingalmost,6644,975,64,24,Approaching (Almost) Any Machine Learning Problem,environment.yml,tensorflow,N/A,pytest,7/4/2020
google,flax,https://github.com/google/flax,5545,576,830,2355,Flax is a neural network library for JAX that is designed for flexibility.,pyproject.toml,tensorflow,N/A,pytest,1/10/2020
blei-lab,edward,https://github.com/blei-lab/edward,4817,743,514,438,A probabilistic programming language in TensorFlow. Deep generative models<> variational inference.,setup.py,tensorflow,N/A,pytest,2/10/2016
uber,causalml,https://github.com/uber/causalml,4778,738,383,340,Uplift modeling and causal inference with machine learning algorithms,pyproject.toml,tensorflow,N/A,pytest,7/9/2019
idealo,image-super-resolution,https://github.com/idealo/image-super-resolution,4509,725,216,35,🔎 Super-scale your images and run experiments with Residual Dense and Adversarial Networks.,setup.py,tensorflow,N/A,pytest,11/26/2018
tensortrade-org,tensortrade,https://github.com/tensortrade-org/tensortrade,4388,956,247,215,"An open source reinforcement learning framework for training<> evaluating, and deploying robust trading agents.",setup.py,tensorflow,N/A,pytest,7/30/2019
exadel-inc,CompreFace,https://github.com/exadel-inc/CompreFace,4237,562,273,846,Leading free and open-source face recognition system,requirements.txt,tensorflow,N/A,pytest,7/6/2020
adap,flower,https://github.com/adap/flower,4237,737,521,2680,Flower: A Friendly Federated Learning Framework,pyproject.toml,tensorflow,N/A,pytest,2/17/2020
SeldonIO,seldon-core,https://github.com/SeldonIO/seldon-core,4230,810,2291,3286,"An MLOps framework to package<> deploy, monitor and manage thousands of production machine learning models",requirements.txt,tensorflow,N/A,pytest,12/20/2017
IDSIA,sacred,https://github.com/IDSIA/sacred,4161,364,558,367,"Sacred is a tool to help you configure<> organize, log and reproduce experiments developed at IDSIA.",tox.ini,tensorflow,N/A,pytest,3/31/2014
dependabot,dependabot-core,https://github.com/dependabot/dependabot-core,3882,844,3248,6214,🤖 Dependabot's core logic for creating update PR's.,pipfile_files_parser_spec.rb,tensorflow,N/A,pytest,6/2/2017
yahoo,TensorFlowOnSpark,https://github.com/yahoo/TensorFlowOnSpark,3868,915,368,226,TensorFlowOnSpark brings TensorFlow programs to Apache Spark clusters.,tox.ini,tensorflow,N/A,pytest,1/20/2017
NTMC-Community,MatchZoo,https://github.com/NTMC-Community/MatchZoo,3820,885,463,385,Facilitating the design<> comparison and sharing of deep text matching models.,requirements.txt,tensorflow,N/A,pytest,6/8/2017
TensorSpeech,TensorFlowTTS,https://github.com/TensorSpeech/TensorFlowTTS,3714,770,682,119,":stuck_out_tongue_closed_eyes: TensorFlowTTS: Real-Time State-of-the-art Speech Synthesis for Tensorflow 2 (supported including English<> French, Korean, Chinese, German and Easy to adapt for other languages)",setup.py,tensorflow,N/A,pytest,3/22/2020
PAIR-code,lit,https://github.com/PAIR-code/lit,3400,342,127,1332,The Learning Interpretability Tool: Interactively analyze ML models to understand their behavior in an extensible and framework agnostic interface.,pyproject.toml,tensorflow,N/A,pytest,7/28/2020
lancedb,lance,https://github.com/lancedb/lance,3296,168,782,1510,"Modern columnar data format for ML and LLMs implemented in Rust. Convert from parquet in 2 lines of code for 100x faster random access<> vector index, and data versioning. Compatible with Pandas, DuckDB, Polars, Pyarrow, with more integrations coming..",pyproject.toml,tensorflow,N/A,pytest,7/7/2022
tensorforce,tensorforce,https://github.com/tensorforce/tensorforce,3284,518,673,239,Tensorforce: a TensorFlow library for applied reinforcement learning,setup.py,tensorflow,N/A,pytest,3/19/2017
Giskard-AI,giskard,https://github.com/Giskard-AI/giskard,3166,197,424,1457,🐢 Open-Source Evaluation & Testing framework for LLMs and ML models,pyproject.toml,tensorflow,N/A,pytest,3/6/2022
kserve,kserve,https://github.com/kserve/kserve,3089,918,1698,1854,Standardized Serverless ML Inference Platform on Kubernetes,pyproject.toml,tensorflow,N/A,pytest,3/27/2019
spotify,basic-pitch,https://github.com/spotify/basic-pitch,2956,213,67,57,A lightweight yet powerful audio-to-MIDI converter with pitch bend detection,pyproject.toml,tensorflow,N/A,pytest,5/3/2022
parrt,dtreeviz,https://github.com/parrt/dtreeviz,2847,330,202,120,A python library for decision tree visualization and model interpretation.,setup.py,tensorflow,N/A,pytest,8/13/2018
docarray,docarray,https://github.com/docarray/docarray,2772,217,635,1237,"Represent<> send, store and search multimodal data",pyproject.toml,tensorflow,N/A,pytest,12/14/2021
GoogleCloudPlatform,professional-services,https://github.com/GoogleCloudPlatform/professional-services,2737,1212,167,1110,Common solutions and tools developed by Google Cloud's Professional Services team. This repository and its contents are not an officially supported Google product.,requirements.txt,tensorflow,N/A,pytest,5/18/2017
TeamHG-Memex,eli5,https://github.com/TeamHG-Memex/eli5,2728,319,257,167,A library for debugging/inspecting machine learning classifiers and explaining their predictions,tox.ini,tensorflow,N/A,pytest,9/15/2016
google,BIG-bench,https://github.com/google/BIG-bench,2670,521,149,849,Beyond the Imitation Game collaborative benchmark for measuring and extrapolating the capabilities of language models,requirements.txt,tensorflow,N/A,pytest,1/15/2021
bethgelab,foolbox,https://github.com/bethgelab/foolbox,2662,411,369,365,"A Python toolbox to create adversarial examples that fool neural networks in PyTorch<> TensorFlow, and JAX",setup.py,tensorflow,N/A,pytest,6/14/2017
cybertronai,gradient-checkpointing,https://github.com/cybertronai/gradient-checkpointing,2622,266,42,15,Make huge neural nets fit in memory,requirements.txt,tensorflow,N/A,pytest,9/26/2017
KichangKim,DeepDanbooru,https://github.com/KichangKim/DeepDanbooru,2496,243,90,13,AI based multi-label girl image classification system<> implemented by using TensorFlow.,setup.py,tensorflow,N/A,pytest,12/20/2019
huggingface,safetensors,https://github.com/huggingface/safetensors,2462,148,154,301,Simple<> safe way to store and distribute tensors,pyproject.toml,tensorflow,N/A,pytest,9/22/2022
rail-berkeley,rlkit,https://github.com/rail-berkeley/rlkit,2370,510,130,43,Collection of reinforcement learning algorithms,requirements.txt,tensorflow,N/A,pytest,1/25/2018
Trusted-AI,AIF360,https://github.com/Trusted-AI/AIF360,2321,794,245,284,"A comprehensive set of fairness metrics for datasets and machine learning models<> explanations for these metrics, and algorithms to mitigate bias in datasets and models.",setup.py,tensorflow,N/A,pytest,8/22/2018
pytorch,xla,https://github.com/pytorch/xla,2302,392,1765,5273,Enabling PyTorch on XLA Devices (e.g. Google TPU),pyproject.toml,tensorflow,N/A,pytest,11/5/2018
PythonOT,POT,https://github.com/PythonOT/POT,2259,473,226,364,POT : Python Optimal Transport,requirements.txt,tensorflow,N/A,pytest,10/20/2016
deepdoctection,deepdoctection,https://github.com/deepdoctection/deepdoctection,2219,111,163,111,A Repo For Document AI,setup.py,tensorflow,N/A,pytest,12/9/2021
huggingface,optimum,https://github.com/huggingface/optimum,2175,362,654,1181,🚀 Accelerate training and inference of 🤗 Transformers and 🤗 Diffusers with easy to use hardware optimization tools,setup.py,tensorflow,N/A,pytest,7/20/2021
sonos,tract,https://github.com/sonos/tract,2064,197,237,1132,"Tiny<> no-nonsense, self-contained, Tensorflow and ONNX inference",setup.py,tensorflow,N/A,pytest,8/7/2017
qubvel,efficientnet,https://github.com/qubvel/efficientnet,2061,461,114,43,Implementation of EfficientNet model. Keras and TensorFlow Keras.,setup.py,tensorflow,N/A,pytest,5/30/2019
pyro-ppl,numpyro,https://github.com/pyro-ppl/numpyro,2051,214,735,1058,Probabilistic programming with NumPy powered by JAX for autograd and JIT compilation to GPU/TPU/CPU.,pyproject.toml,tensorflow,N/A,pytest,2/13/2019
openvinotoolkit,openvino_notebooks,https://github.com/openvinotoolkit/openvino_notebooks,1992,704,276,1637,📚 Jupyter notebook tutorials for OpenVINO™,Pipfile.lock,tensorflow,N/A,pytest,3/11/2021
MarcSkovMadsen,awesome-streamlit,https://github.com/MarcSkovMadsen/awesome-streamlit,1963,334,30,68,The purpose of this project is to share knowledge on how awesome Streamlit is and can be,requirements_base.txt,tensorflow,N/A,pytest,10/6/2019
dickreuter,Poker,https://github.com/dickreuter/Poker,1903,485,147,84,"Fully functional Pokerbot that works on PartyPoker<> PokerStars and GGPoker, scraping tables with Open-CV (adaptable via gui) or neural network and making decisions based on a genetic algorithm and montecarlo simulation for poker equity calculation. Binaries can be downloaded with this link:",requirements_win.txt,tensorflow,N/A,pytest,3/29/2016
philipperemy,keras-tcn,https://github.com/philipperemy/keras-tcn,1838,436,166,92,Keras Temporal Convolutional Network.,tox.ini,tensorflow,N/A,pytest,3/22/2018
huggingface,evaluate,https://github.com/huggingface/evaluate,1830,220,268,322,🤗 Evaluate: A library for easily evaluating machine learning models and datasets.,setup.py,tensorflow,N/A,pytest,3/30/2022
rlworkgroup,garage,https://github.com/rlworkgroup/garage,1817,302,1010,1313,A toolkit for reproducible reinforcement learning research.,setup.py,tensorflow,N/A,pytest,6/10/2018
mlech26l,ncps,https://github.com/mlech26l/ncps,1805,285,59,5,"PyTorch and TensorFlow implementation of NCP<> LTC, and CfC wired neural models",requirements.txt,tensorflow,N/A,pytest,8/25/2020
google,TensorNetwork,https://github.com/google/TensorNetwork,1775,344,353,617,A library for easy and efficient manipulation of tensor networks.,requirements_travis.txt,tensorflow,N/A,pytest,4/25/2019
uber,petastorm,https://github.com/uber/petastorm,1754,276,307,495,"Petastorm library enables single machine or distributed training and evaluation of deep learning models from datasets in Apache Parquet format. It supports ML frameworks such as Tensorflow<> Pytorch, and PySpark and can be used from pure Python code.",setup.py,tensorflow,N/A,pytest,6/15/2018
sokrypton,ColabFold,https://github.com/sokrypton/ColabFold,1731,436,520,100,Making Protein folding accessible to all!,pyproject.toml,tensorflow,N/A,pytest,7/19/2021
ahmedfgad,GeneticAlgorithmPython,https://github.com/ahmedfgad/GeneticAlgorithmPython,1728,444,151,89,Source code of PyGAD<> a Python 3 library for building the genetic algorithm and training machine learning algorithms (Keras & PyTorch).,pyproject.toml,tensorflow,N/A,pytest,12/11/2018
TMElyralab,MuseV,https://github.com/TMElyralab/MuseV,1618,145,65,45,MuseV: Infinite-length and High Fidelity Virtual Human Video Generation with Visual Conditioned Parallel Denoising,environment.yml,tensorflow,N/A,pytest,3/25/2024
nyu-mll,jiant,https://github.com/nyu-mll/jiant,1610,290,556,801,jiant is an nlp toolkit,setup.py,tensorflow,N/A,pytest,6/18/2018
DT42,BerryNet,https://github.com/DT42/BerryNet,1594,231,48,30,Deep learning gateway on Raspberry Pi and other edge devices,pyproject.toml,tensorflow,N/A,pytest,4/27/2017
openai,multi-agent-emergence-environments,https://github.com/openai/multi-agent-emergence-environments,1585,297,31,20,"Environment generation code for the paper ""Emergent Tool Use From Multi-Agent Autocurricula""",requirements_ma_policy.txt,tensorflow,N/A,pytest,8/12/2019
Music-and-Culture-Technology-Lab,omnizart,https://github.com/Music-and-Culture-Technology-Lab/omnizart,1565,92,73,36,"Omniscient Mozart<> being able to transcribe everything in the music, including vocal, drum, chord, beat, instruments, and more.",pyproject.toml,tensorflow,N/A,pytest,8/26/2020
crownpku,Rasa_NLU_Chi,https://github.com/crownpku/Rasa_NLU_Chi,1497,419,101,31,Turn Chinese natural language into structured data 中文自然语言理解,setup.py,tensorflow,N/A,pytest,6/21/2017
google-deepmind,bsuite,https://github.com/google-deepmind/bsuite,1466,181,29,22,bsuite is a collection of carefully-designed experiments that investigate core capabilities of a reinforcement learning (RL) agent,setup.py,tensorflow,N/A,pytest,8/2/2019
OpenNMT,OpenNMT-tf,https://github.com/OpenNMT/OpenNMT-tf,1444,382,424,582,Neural machine translation and sequence learning using TensorFlow,setup.py,tensorflow,N/A,pytest,11/2/2017
DLTK,DLTK,https://github.com/DLTK/DLTK,1422,398,31,36,Deep Learning Toolkit for Medical Image Analysis,setup.py,tensorflow,N/A,pytest,5/2/2017
google-research,FLAN,https://github.com/google-research/FLAN,1407,143,75,33,N/A,requirements.txt,tensorflow,N/A,pytest,8/21/2021
kubeflow,examples,https://github.com/kubeflow/examples,1377,711,406,700,A repository to host extended examples and tutorials,requirements.txt,tensorflow,N/A,pytest,2/1/2018
deepmodeling,deepmd-kit,https://github.com/deepmodeling/deepmd-kit,1372,467,671,1823,A deep learning package for many-body potential energy representation and molecular dynamics,pyproject.toml,tensorflow,N/A,pytest,12/12/2017
Xilinx,Vitis-AI,https://github.com/Xilinx/Vitis-AI,1371,611,1284,147,Vitis AI is Xilinx’s development stack for AI inference on Xilinx hardware platforms<> including both edge devices and Alveo cards.,setup.py,tensorflow,N/A,pytest,10/16/2019
advboxes,AdvBox,https://github.com/advboxes/AdvBox,1367,254,38,65,Advbox is a toolbox to generate adversarial examples that fool neural networks in PaddlePaddle、PyTorch、Caffe2、MxNet、Keras、TensorFlow and Advbox can benchmark the robustness of machine learning models.  Advbox give a command line tool to generate adversarial examples with Zero-Coding.,setup.py,tensorflow,N/A,pytest,8/8/2018
faustomorales,keras-ocr,https://github.com/faustomorales/keras-ocr,1333,318,0,43,A packaged and flexible version of the CRAFT text detector and Keras CRNN recognition model.,pyproject.toml,tensorflow,N/A,pytest,9/20/2019
tf-coreml,tf-coreml,https://github.com/tf-coreml/tf-coreml,1329,169,256,143,TensorFlow to CoreML Converter,requirements.pip,tensorflow,N/A,pytest,10/11/2017
magenta,mt3,https://github.com/magenta/mt3,1311,178,88,62,MT3: Multi-Task Multitrack Music Transcription,setup.py,tensorflow,N/A,pytest,11/3/2021
datitran,object_detector_app,https://github.com/datitran/object_detector_app,1293,733,49,9,Real-Time Object Recognition App with Tensorflow and OpenCV,environment.yml,tensorflow,N/A,pytest,6/19/2017
linkedin,detext,https://github.com/linkedin/detext,1256,132,17,59,DeText: A Deep Neural Text Understanding Framework for Ranking and Classification Tasks ,setup.py,tensorflow,N/A,pytest,1/16/2020
microsoft,responsible-ai-toolbox,https://github.com/microsoft/responsible-ai-toolbox,1227,313,275,2266,Responsible AI Toolbox is a suite of tools providing model and data exploration and assessment user interfaces and libraries that enable a better understanding of AI systems. These interfaces and libraries empower developers and stakeholders of AI systems to develop and monitor AI more responsibly<> and take better data-driven actions.,requirements-dev.txt,tensorflow,N/A,pytest,7/6/2020
albermax,innvestigate,https://github.com/albermax/innvestigate,1226,230,258,68,A toolbox to iNNvestigate neural networks' predictions!,pyproject.toml,tensorflow,N/A,pytest,12/13/2017
tensorflow,text,https://github.com/tensorflow/text,1197,324,249,1020,Making text a first-class citizen in TensorFlow.,setup.py,tensorflow,N/A,pytest,5/29/2019
rail-berkeley,softlearning,https://github.com/rail-berkeley/softlearning,1163,230,103,101,Softlearning is a reinforcement learning framework for training maximum entropy policies in continuous domains. Includes the official implementation of the Soft Actor-Critic algorithm.,requirements.txt,tensorflow,N/A,pytest,12/3/2018
PacktPublishing,Deep-Reinforcement-Learning-Hands-On-Second-Edition,https://github.com/PacktPublishing/Deep-Reinforcement-Learning-Hands-On-Second-Edition,1058,506,44,34,Deep-Reinforcement-Learning-Hands-On-Second-Edition<> published by Packt,environment.yml,tensorflow,N/A,pytest,7/3/2019
NVIDIA-Merlin,Transformers4Rec,https://github.com/NVIDIA-Merlin/Transformers4Rec,1041,141,402,363,Transformers4Rec is a flexible and efficient library for sequential and session-based recommendation and works with PyTorch.,tox.ini,tensorflow,N/A,pytest,4/14/2021
philipperemy,keract,https://github.com/philipperemy/keract,1036,184,88,73,Layers Outputs and Gradients in Keras. Made easy.,tox.ini,tensorflow,N/A,pytest,5/17/2017
sicara,tf-explain,https://github.com/sicara/tf-explain,1008,110,90,98,Interpretability Methods for tf.keras models with Tensorflow 2.x,setup.py,tensorflow,N/A,pytest,7/15/2019
NVIDIA-Merlin,NVTabular,https://github.com/NVIDIA-Merlin/NVTabular,1008,141,782,1081,NVTabular is a feature engineering and preprocessing library for tabular data designed to quickly and easily manipulate terabyte scale datasets used to train deep learning based recommender systems.,pyproject.toml,tensorflow,N/A,pytest,4/3/2020
AlibabaResearch,DAMO-ConvAI,https://github.com/AlibabaResearch/DAMO-ConvAI,1001,161,125,20,DAMO-ConvAI: The official repository which contains the codebase for Alibaba DAMO Conversational AI.,requirements.txt,tensorflow,N/A,pytest,7/15/2022
tensorflow,similarity,https://github.com/tensorflow/similarity,998,106,189,185,TensorFlow Similarity is a python package focused on making similarity learning quick and easy.,setup.py,tensorflow,N/A,pytest,6/15/2020
pykaldi,pykaldi,https://github.com/pykaldi/pykaldi,978,241,276,45,A Python wrapper for Kaldi,setup.py,tensorflow,N/A,pytest,6/19/2017
sintel-dev,Orion,https://github.com/sintel-dev/Orion,970,156,279,256,A machine learning library for detecting anomalies in signals. ,setup.py,tensorflow,N/A,pytest,7/24/2018
keras-team,keras-cv,https://github.com/keras-team/keras-cv,953,301,966,1405,Industry-strength Computer Vision workflows with Keras,setup.py,tensorflow,N/A,pytest,5/18/2020
